{
  "schemaVersion": "2.0",
  "origin": "counselor",
  "recordStatus": "exception",
  "id": "cp-000289",
  "programmeProvider": {
    "counselorProgrammeId": "cp-000289",
    "registryName": "Economie en Samenleving",
    "registryOrder": 289,
    "productionOrder": 286,
    "normalizedInstitutionIds": [
      "leiden"
    ],
    "programmeType": "standard",
    "currentStatus": "active",
    "productionEligible": true,
    "languages": [
      "NLD"
    ],
    "modes": [
      "VOLTIJD"
    ],
    "sourceExcelRows": [
      303
    ],
    "offeredProgrammeIds": [
      "4b7ca1e3-7b76-44b9-91d7-5cba443515c4"
    ],
    "programmeUnitCodes": [
      "1001O8921"
    ],
    "recognizedProgrammeCodes": [
      "50996"
    ],
    "variantOfCodes": []
  },
  "comparator": {
    "name": "Economics & Society",
    "institution": "Leiden University",
    "primarySourceUrl": "https://studiegids.universiteitleiden.nl/api/product?code=BA-ECS&type=STUDY&year=2261&language=en",
    "academicYear": "2026-2027",
    "additionalSourceUrls": [
      "https://studiegids.universiteitleiden.nl/studies/BA-ECS?year=2261",
      "https://www.universiteitleiden.nl/onderwijs/opleidingen/bachelor/fdr-economie--samenleving"
    ],
    "sourceNotes": "The live Leiden Study Guide confirms a current 180-EC Economics & Society bachelor and publishes the applicable first and second years in full. Year 1 is a 60-EC compulsory foundation in economics, mathematics, statistics, programming and data visualisation, econometrics, politics, law, welfare, institutions and behavioural economics. Year 2 contains 50 EC of compulsory public, international, environmental, labour, migration, inequality and EU economics, Dutch politics, tax law and applied econometrics, plus one 10-EC restricted package in either law or politics. The same official product explicitly states that Year 3 will be included in the 2027-2028 Study Guide. Only the supported 120 EC are retained; the unpublished final year is not inferred.",
    "components": [
      {
        "id": "year-1-compulsory",
        "name": "Year 1 compulsory economics, methods and societal foundations",
        "credits": 60,
        "note": "Twelve compulsory modules covering Economics and Society, mathematics, programming and data visualisation, statistics, microeconomics, macroeconomics, econometrics, politics, law, welfare economics, policy and markets, and behavioural economics."
      },
      {
        "id": "year-2-compulsory",
        "name": "Year 2 compulsory economics, policy, institutions and methods",
        "credits": 50,
        "note": "Ten compulsory modules covering public, international, environmental, labour, migration, inequality and EU economics, Dutch politics, tax law and applied econometrics."
      },
      {
        "id": "year-2-restricted-choice",
        "name": "Year 2 restricted law or politics package",
        "credits": 10,
        "note": "Students choose either European Law plus Social Law or Comparative Politics plus Politics of the European Union."
      }
    ]
  },
  "programmes": [
    {
      "id": "comparator",
      "role": "comparator",
      "family": "comparator",
      "label": "Economics & Society at Leiden University"
    }
  ],
  "exception": {
    "type": "external-programme-unresolved",
    "checkedOn": "2026-10-06",
    "reason": "Leiden is introducing Economics & Society cohort by cohort. The current 2026-2027 Study Guide establishes the complete first and second years but explicitly says that Year 3 will only be included in the 2027-2028 guide. A complete coherent 180-EC pathway for a Fall 2026 entrant therefore cannot yet be reconstructed from current official evidence. Inferring the remaining 60 EC would invent the advanced economics, interdisciplinary, elective and research or thesis requirements.",
    "curriculumContext": "The supported curriculum totals 120 EC. Year 1 is a 60-EC compulsory foundation combining economic theory with mathematics, statistics, programming, data visualisation, econometrics, politics, law, welfare, institutions and behavioural economics. Year 2 contains 50 EC of compulsory applied economics, policy, institutions and econometrics plus a 10-EC restricted-choice package in law or politics. The official product confirms that the bachelor as a whole is 180 EC, but its applicable final 60 EC are not yet published."
  }
}
