{
  "schemaVersion": "2.0",
  "origin": "counselor",
  "recordStatus": "exception",
  "id": "cp-000364",
  "programmeProvider": {
    "counselorProgrammeId": "cp-000364",
    "registryName": "Politiek, cultuur en religie | Religiewetenschappen",
    "registryOrder": 364,
    "productionOrder": 361,
    "normalizedInstitutionIds": [
      "uu"
    ],
    "programmeType": "standard",
    "currentStatus": "active",
    "productionEligible": true,
    "languages": [
      "NLD"
    ],
    "modes": [
      "VOLTIJD"
    ],
    "sourceExcelRows": [
      377
    ],
    "offeredProgrammeIds": [
      "a57b71a2-0ac3-416f-bc6a-17d0cfccc6e9"
    ],
    "programmeUnitCodes": [
      "1016O8474"
    ],
    "recognizedProgrammeCodes": [],
    "variantOfCodes": [
      "50902"
    ]
  },
  "comparator": {
    "name": "Politiek, cultuur en religie",
    "institution": "Utrecht University",
    "primarySourceUrl": "https://www.uu.nl/bachelors/politiek-cultuur-en-religie/studieprogramma",
    "academicYear": "Current entrant curriculum, checked 2026-09-28",
    "route": "Verdiepingspakket Politiek en religie",
    "additionalSourceUrls": [
      "https://www.uu.nl/bachelors/politiek-cultuur-en-religie",
      "https://students.uu.nl/gw/religiewetenschappen/mijn-studie/studieprogramma"
    ],
    "sourceNotes": "Utrecht presents Politics, Culture and Religion as the continuation under a new name of Religious Studies. The current prospective-student curriculum identifies eight named first-year courses arranged as two four-course foundation packages, three named depth-package options, one-third free-choice space, a research seminar and a final project. The current student curriculum for the 2025-entry predecessor confirms the architecture of 60 EC in two foundation packages, a 30-EC depth package, 15 EC in two compulsory courses, 15 EC for the research seminar and final project, and 60 EC of profiling space. However, Utrecht explicitly states that it is still developing the course package for the renamed programme and that content is missing. The current page does not identify the two compulsory 15-EC major courses for new entrants, does not provide a complete credit-bearing 180-EC curriculum, and lists five items under the four-course Politics and Religion package, including two items both labelled Block 3. Combining the predecessor's unnamed requirements with the incomplete new page would therefore require guessing. The supported components below retain only the architecture and named current elements that can be established without inventing the missing 15 EC.",
    "components": [
      {
        "id": "pcr-y1-01",
        "name": "Politiek, cultuur en religie: tussen vrijheid en dwang",
        "credits": 7.5,
        "note": "Named current first-year course in the two 60-EC foundation packages."
      },
      {
        "id": "pcr-y1-02",
        "name": "Traditie in verandering",
        "credits": 7.5,
        "note": "Named current first-year course in the two 60-EC foundation packages."
      },
      {
        "id": "pcr-y1-03",
        "name": "Bijbel en Koran als politiek-culturele teksten",
        "credits": 7.5,
        "note": "Named current first-year course in the two 60-EC foundation packages."
      },
      {
        "id": "pcr-y1-04",
        "name": "Autoriteit en verbeelding in nieuwe media en populaire cultuur",
        "credits": 7.5,
        "note": "Named current first-year course in the two 60-EC foundation packages."
      },
      {
        "id": "pcr-y1-05",
        "name": "Cultureel-antropologische benaderingen: Geleefde religie en spiritualiteit in een seculiere context",
        "credits": 7.5,
        "note": "Named current first-year course in the two 60-EC foundation packages."
      },
      {
        "id": "pcr-y1-06",
        "name": "Macht, recht en soevereiniteit",
        "credits": 7.5,
        "note": "Named current first-year course in the two 60-EC foundation packages."
      },
      {
        "id": "pcr-y1-07",
        "name": "Complottheorieën: van Armageddon tot QAnon",
        "credits": 7.5,
        "note": "Named current first-year course in the two 60-EC foundation packages."
      },
      {
        "id": "pcr-y1-08",
        "name": "Antisemitisme en islamofobie",
        "credits": 7.5,
        "note": "Named current first-year course in the two 60-EC foundation packages."
      },
      {
        "id": "pcr-depth-politics-religion",
        "name": "Verdiepingspakket Politiek en religie",
        "credits": 30,
        "note": "First-listed current 30-EC depth package; retained at package level because the current page's course list is internally unresolved."
      },
      {
        "id": "pcr-research-thesis",
        "name": "Onderzoeksseminar en eindwerkstuk",
        "credits": 15,
        "note": "Current page names both elements; the official student curriculum assigns 15 EC to them together."
      },
      {
        "id": "pcr-profile",
        "name": "Keuzeruimte / profileringsruimte",
        "credits": 60,
        "note": "The current page identifies one-third of the programme as genuine free-choice space."
      }
    ],
    "routeSelection": {
      "route": "Verdiepingspakket Politiek en religie",
      "selectionRule": "official-order-tiebreak",
      "basis": "The generic normalized target does not name a specialization. The current programme page presents Politics and Religion, Culture and Religion, and The Middle East as equally formal depth packages and does not designate one as broader or more representative. Politics and Religion is therefore retained as the first-listed neutral tie-break, independently of UCR fit; this route judgment does not resolve the missing curriculum components."
    }
  },
  "programmes": [
    {
      "id": "comparator",
      "role": "comparator",
      "family": "comparator",
      "label": "Politiek, cultuur en religie at Utrecht University"
    }
  ],
  "exception": {
    "type": "external-programme-unresolved",
    "checkedOn": "2026-09-28",
    "reason": "Utrecht's current official page says the renamed programme's course package is still being developed and contains missing content. It establishes the eight-course first year, the depth-package choices, research seminar, final project and 60 EC of free-choice space, but does not identify the two compulsory courses that account for the remaining 15 EC of the 120-EC major. The first-listed Politics and Religion package is also internally listed with five course items for a four-course package, including two Block 3 entries. A complete current 180-EC pathway cannot therefore be certified without either importing unconfirmed predecessor requirements or arbitrarily deciding which published package item applies.",
    "curriculumContext": "The supported current structure accounts for 165 EC: eight named first-year courses in two 60-EC foundation packages, the 30-EC first-listed Politics and Religion depth package, a 15-EC research-seminar/final-project combination, and 60 EC of genuine free-choice space. The predecessor student curriculum confirms that the major also requires two compulsory courses totalling 15 EC, but the renamed programme's current page does not name or describe them. Revisit the target when Utrecht publishes the completed entrant curriculum and resolves the depth-package listing."
  }
}
